ID-MEMBRO	RELEVANTE	AUTORES	TITULO	ANO	NATUREZA	ITEM
{3}		CREMON, E. H.	Revisão para o Journal of South American Earth Sciences	2022			
{3}		CREMON, E. H.	Parecer para a revista Environmental Processes	2022			
{9}		GOMES, R. A.	Avaliador do artigo #13 submetido em 22nd IEEE International Conference on Environment and Electrical Engineering	2022			
{9}		GOMES, R. A.	Avaliador do artigo #165 submetido em 22nd IEEE International Conference on Environment and Electrical Engineering	2022			
{9}		GOMES, R. A.	Membro de comitê de programa em Fifth International Conference on Applied Informatics (ICAI 2022)	2022			
{9}		GOMES, R. A.	Membro de comitê de programa em 9º Encontro Nacional de Computação dos Institutos Federais	2022			
{9}		GOMES, R. A.	Avaliador do artigo #222962 submetido em 9º Encontro Nacional de Computação dos Institutos Federais	2022			
{9}		GOMES, R. A.	Avaliador do artigo #223027 submetido em 9º Encontro Nacional de Computação dos Institutos Federais	2022			
{9}		GOMES, R. A.	Avaliador do artigo #38842 submetido na Revista Docência no Ensino Superior	2022			
{9}		GOMES, R. A.	Avaliador do artigo #201 submetido em 22nd IEEE International Conference on Environment and Electrical Engineering	2022			
{9}		GOMES, R. A.	Avaliador do artigo #203 submetido em 22nd IEEE International Conference on Environment and Electrical Engineering	2022			
{9}		GOMES, R. A.	Avaliador do artigo #39 em International Conference on Advanced Research in Technologies, Information, Innovation and Sustainability	2022			
{9}		GOMES, R. A.	Avaliador do artigo #104 em International Conference on Advanced Research in Technologies, Information, Innovation and Sustainability	2022			
{9}		GOMES, R. A.	Avaliador do artigo #1342 em Fifth International Conference on Applied Informatics	2022			
{9}		GOMES, R. A.	Avaliador do artigo #5595 em Fifth International Conference on Applied Informatics	2022			
{9}		GOMES, R. A.	Membro da Etapa II de avaliação de propostas (Análise de Mérito) da CHAMADA PÚBLICA 03/2022, CHAMADA PÚBLICA No 03/2022 - AUXÍLIO À PESQUISA CIENTÍFICA E TECNOLÓGICA	2022			
{9}		GOMES, R. A.	Avaliador do artigo #202 submetido em 22nd IEEE International Conference on Environment and Electrical Engineering	2022			
{11}		OLIVEIRA, S.	PARECER TÉCNICO DE ANÁLISES FÍSICO-QUÍMICAS DE EFLUENTE BRUTO E TRATADO	2022			
{11}		SILVA, I. C.; OLIVEIRA, S.	Diagnóstico Ambiental de Áreas Degradadas	2022			
{3}		CREMON, E. H.	Parecer para a revista Earth Surface Processes and Landforms	2021			
{9}		GOMES, R. A.	Revisão de artigo - ParadigmPlus e-ISSN: 2711-4627	2021			
{9}		GOMES, R. A.	Membro de comitê de programa em Fourth International Conference on Applied Informatics (ICAI 2021)	2021			
{9}		GOMES, R. A.	Membro de comitê de programa em International Conference on Advanced Research in Technologies, Information, Innovation and Sustainability	2021			
{9}		GOMES, R. A.	Membro de comitê de programa em 8 Encontro Nacional de Computação dos Institutos Federais (ENCompIF)	2021			
{9}		GOMES, R. A.	Revisão de artigo - #86 2021 IEEE International Conference on Environment and Electrical Engineering	2021			
{9}		GOMES, R. A.	Revisão de artigo - #165 2021 IEEE International Conference on Environment and Electrical Engineering	2021			
{9}		GOMES, R. A.	Revisão de artigo - #185 2021 IEEE International Conference on Environment and Electrical Engineering	2021			
{9}		GOMES, R. A.	Technical Program Committee member - 11th International Advanced Computing Conference	2021			
{9}		GOMES, R. A.	Avaliador de artigo submetido ao FTT Journal of Engineering and Business	2021			
{9}		GOMES, R. A.	Parecerista Ad Hoc do Cadastro de Projeto de Pesquisa intitulado 'PROPOSTA DE INTEGRAÇÃO DA REDE DE ACESSO NÃO-3GPP IEEE 802.11 AO NÚCLEO 5G', de No 2021025614205399, vinculado ao Instituto Federal de Educação, Ciência e Tecnologia de Goiás - Câmpus Formosa	2021			
{9}		GOMES, R. A.	Revisão de artigo - Expressa Extensão	2021			
{9}		GOMES, R. A.	Avaliador de projetos de ensino no Edital N° 12/2021/PROEN/IFG	2021			
{9}		GOMES, R. A.	Avaliador de projetos de pesquisa para o Edital n. 03/2020/PRPG/IFBA	2020			
{9}		GOMES, R. A.	Membro do Comitê de Programa no 7º Encontro Nacional de Computação dos Institutos Federais (ENCompIF)	2020			
{9}		GOMES, R. A.	Membro de comitê de programa em Third International Conference on Applied Informatics (ICAI 2020)	2020			
{9}		GOMES, R. A.	Membro de comitê de programa em Sixth International Symposium on Intelligent Systems Technologies and Applications (ISTA'20)	2020			
{9}		GOMES, R. A.	Revisão de artigo - HOLOS ISSN 1807-1600	2020			
{11}		DE OLIVEIRA, S. B.; FERNANDES, L. C.	Relatório de Avaliação Preliminar de Investigação de Passivo Ambiental	2019			
{6}		SACHO, S. D.; CAMPOS, L. C.; LEANDRO, W. M.; ZANG, J. W.; DA FONSECA-ZANG, W. A.	Resíduos Sólidos Domiciliares: Alternativas para o Rural na Política Nacional de Resíduos Sólidos	2019			
{11}		OLIVEIRA, S. B.	Parecer Técnico Água do Sistema Osmose ? Clínicas de Hemodiálise	2017			
{11}		OLIVEIRA, S. B.	Parecer Técnico referente a caracterização e classificação dos resíduos sólidos oriundos do processo moagem de tomate da planta industrial HEINZ BRASIL S.A, Município de Nerópolis - GO	2017			
{11}		OLIVEIRA, S. B.	Péricia Técnica sobre processo de fabricação de fraldas descatáveis	2017			
{6}		ZANG, J. W.	Dry Fermentation for biogas technology	2017			
{12}		DA FONSECA-ZANG, W. A.	concurso para Professor Titular do DEC, aberto pelo EDITAL No 57/2016-PRH - Hidráulica e Saneamento	2016			
{11}		OLIVEIRA, S. B.; COSTA, O. S.	Parecer Técnico Referente à Comercialização de Mechas de Cabelos Importados	2016			
{11}		OLIVEIRA, S. B.	Parecer Técnico: Complemento ao Estudo de Investigação de Passivo Ambiental do empreendimento São Salvador Alimentos S/A	2015			
{11}		OLIVEIRA, S. B.	Péricia Técnica sobre processo de fabricação de Medicamentos Alopáticos de uso humano	2015			
{11}		OLIVEIRA, S. B.; BARBOSA, D. P.	Ação Declaratória de Inexistência de Infração Administrativa e Débito com Pedido de Antecipação de Tutela	2015			
{11}		OLIVEIRA, S. B.; BARBOSA, D. P.	LAUDO PERICIAL: ação trabalhista - equiparação de função de técnico de saneamento	2015			
{11}		OLIVEIRA, S. B.; BARBOSA, D. P.; COSTA, O. S.	Perícia Judicial: Produção Antecipada de Provas ? Ação de indenização por danos morais e materiais	2015			
{11}		OLIVEIRA, S. B.; BARBOSA, D. P.; COSTA, O. S.	LAUDO PERICIAL Produção antecipada de provas: recobrimento de superfície	2014			
{11}		OLIVEIRA, S. B.; COSTA, O. S.	Produção Antecipada de Provas ? Análise das Propriedades Físico-químicas do material encontrado no Lago Paranoá	2014			
{11}		OLIVEIRA, S. B.	PARECER TÉCNICO REFERENTE ÀS ATIVIDADES DE INDUSTRIALIZAÇÃO DE ÁGUA MINERAL	2013			
{11}		OLIVEIRA, S. B.	PARECER TÉCNICO REFERENTE ÀS ATIVIDADES DE INDUSTRIALIZAÇÃO DE COSMÉTICOS	2013			
{11}		OLIVEIRA, S. B.; COSTA, O. S.	Atividades de Industrialização de Cosméticos (Parecer Técnico)	2013			
{11}		OLIVEIRA, S. B.; COSTA, O. S.; TEXEIRA, L. M.	Perícia Judicial: Produção Antecipada de Provas ? Condutos forçados da PCH	2013			
{11}		OLIVEIRA, S. B.; FERNANDES, I. L.	Perícia Judicial: Ação de Cancelamento e Sustação de Protesto com Pedido de Antecipação de Tutela c/c Danos Morais e Materiais	2013			
{11}		OLIVEIRA, S. B.; PINTO, L. R.	RELATÓRIO DE ESTUDO DE EFICIÊNCIA DA ETE E IMPACTO DE VIZINHANÇA DO EMPREENDIMENTO FRICÓ ALIMENTOS	2013			
{11}		OLIVEIRA, S. B.; PINTO, L. R.	DESCRIÇÃO DO PROCESSO DE GALVANOPLASTIA E TRATAMENTO DE EFLUENTES DA INDUSTRIA METALVIDROS	2013			
{11}		DA COSTA, O. S.; OLIVEIRA, S. B.	Memorial descritivo e de cálculo do projeto do setor de preparação de solução de soda cáustica da Indústria Ceramikalys	2012			
{12}		FONSECA-ZANG, W. A.	CONSOLIDAÇÃO DO PROGRAMA DE MESTRADO EM TECNOLOGIA DE PROCESSOS SUSTENTÁVEIS:AMPLIAR A CAPACIDADE ACADÊMICA E TECNO-LÓGICA INSTALADA E INSTIGAR A PRODUÇÃO QUALIFICADA.	2012			
{12}		FONSECA-ZANG, W. A.	Palestra SIMPEEX IFG	2012			
{11}		OLIVEIRA, S. B.; COSTA, O. S.; CAVALCANTE, L. H.	RELATÓRIO TÉCNICO OTIMIZAÇÃO DO SISTEMA DE PINTURA DE ESQUADRIA METÁLICA AÇO NOBRE	2012			
